{
  "project_id": "lgchem_strategy_2026",
  "client_name": "LG화학 전략부문",
  "industry": "배터리·첨단소재·석유화학 포트폴리오",
  "topic": "LG화학의 중장기 포트폴리오 전환과 수익성 중심 성장 전략",
  "target_company": "LG화학",
  "competitors": [
    "포스코퓨처엠",
    "에코프로비엠",
    "엘앤에프",
    "SK이노베이션"
  ],
  "report_date": "2026-02",
  "target_audience": "CEO",
  "language": "ko-KR",
  "page_count": 15,
  "tone": "executive detailed",
  "must_include": [
    "포트폴리오 재편",
    "고부가 양극재",
    "전구체/원재료 내재화",
    "북미/유럽 고객 확대",
    "IRA/CBAM 규제 대응",
    "석유화학 다운사이클 대응",
    "현금흐름 중심 투자 우선순위",
    "실행 로드맵"
  ],
  "must_avoid": [
    "근거 없는 낙관",
    "출처 없는 수치",
    "실행 책임 없는 권고"
  ],
  "output_style": "consulting",
  "constraints": {
    "max_governing_message_chars": 92,
    "min_evidence_per_claim": 2,
    "max_bullets_per_slide": 5
  }
}
